{
  "eventId": "d6282a46-c2ce-4c47-9308-f0c7bf9aa031",
  "eventType": "PaymentReceived",
  "schemaVersion": 1,
  "aggregateType": "Payment",
  "aggregateId": "85102fe0-846a-4914-8a29-98a34f7a3cf5",
  "aggregateVersion": "1",
  "eventSequence": "1",
  "occurredAt": "2026-09-26T08:00:00Z",
  "recordedAt": "2026-09-26T08:00:01Z",
  "correlationId": "d6282a46-c2ce-4c47-9308-f0c7bf9aa031",
  "causationId": "d6282a46-c2ce-4c47-9308-f0c7bf9aa031",
  "source": "payment-api",
  "payload": {}
}
